{
  "vectorString": "CRITv0.2.0/CP:AW/VS:FX/FP:RR/SR:CA/RL:SC/EV:T/PP:1719792000/SA:1187740800#CVE-2024-6387:ec2:instance",
  "vuln_id": "CVE-2024-6387",
  "provider": "aws",
  "service": "ec2",
  "resource_type": "instance",
  "resource_lifecycle": "stateful_customer",
  "shared_responsibility": "customer_action_required",
  "vex_status": "fixed",
  "template": "arn:aws:ec2:{region}:{account}:instance/{resource-id}",
  "template_format": "aws_arn",
  "temporal": {
    "vulnerability_introduced_date": "2021-10-01",
    "vulnerability_introduced_date_estimated": true,
    "vuln_published_date": "2024-07-01",
    "provider_fix_date": "2024-07-08",
    "service_available_date": "2007-08-22"
  },
  "fix_propagation": "rebuild_and_redeploy",
  "existing_deployments_remain_vulnerable": true,
  "provider_fix_version": {
    "version_type": "ami",
    "comparison": "date_gte",
    "build_date": "2024-07-08",
    "note": "Use AMIs published after 2024-07-08 that include OpenSSH >= 9.8p1, or patch in-place via yum/apt."
  },
  "remediation_actions": [
    {
      "sequence": 1,
      "type": "rebuild_and_redeploy",
      "title": "Rebuild EC2 instance from patched AMI with OpenSSH >= 9.8p1",
      "description": "1. Identify a patched AMI (Amazon Linux 2023 AMIs after 2024-07-08 include the fix).\n2. Launch replacement instance from patched AMI.\n3. Migrate EBS volumes or restore from snapshot if stateful.\n4. Update DNS/load balancer targets.\n5. Terminate old instance.",
      "auto_remediable": false,
      "requires_downtime": true,
      "stateful_impact": "backup_recommended",
      "estimated_downtime_range_seconds": {
        "min": 300,
        "max": 1800
      },
      "compensating_control": false
    },
    {
      "sequence": 2,
      "type": "config_change",
      "title": "Set LoginGraceTime=0 as temporary mitigation",
      "description": "Edit /etc/ssh/sshd_config and set LoginGraceTime 0, then restart sshd:\n  sudo sed -i 's/^#\\?LoginGraceTime.*/LoginGraceTime 0/' /etc/ssh/sshd_config\n  sudo systemctl restart sshd\n\nWarning: This makes sshd vulnerable to connection exhaustion DoS but prevents the RCE race condition.",
      "auto_remediable": true,
      "requires_downtime": false,
      "stateful_impact": "none",
      "compensating_control": true
    }
  ],
  "detections": [
    {
      "provider": "aws",
      "service": "cloudwatch_logs_insights",
      "query_language": "cwli",
      "query": "fields @timestamp, @message | filter @message like /sshd.*SIGALRM/ | sort @timestamp desc | limit 100",
      "detection_phase": "exploitation",
      "description": "Detects SIGALRM signals in sshd logs indicative of regreSSHion exploitation attempts. The race condition triggers alarm handler signals visible in auth logs."
    }
  ]
}
