{
  "vectorString": "CRITv0.2.0/CP:AW/VS:FX/FP:VU/SR:CA/RL:EP/EV:T/PP:1706659200/SA:1428537600#CVE-2024-21626:ecs:task",
  "vuln_id": "CVE-2024-21626",
  "provider": "aws",
  "service": "ecs",
  "resource_type": "task",
  "resource_lifecycle": "ephemeral",
  "shared_responsibility": "customer_action_required",
  "vex_status": "fixed",
  "template": "arn:aws:ecs:{region}:{account}:task/{resource-id}",
  "template_format": "aws_arn",
  "temporal": {
    "vulnerability_introduced_date": "2019-01-01",
    "vulnerability_introduced_date_estimated": true,
    "vuln_published_date": "2024-01-31",
    "provider_acknowledged_date": "2024-01-31",
    "provider_fix_date": "2024-02-02",
    "service_available_date": "2015-04-09"
  },
  "fix_propagation": "version_update",
  "existing_deployments_remain_vulnerable": true,
  "provider_fix_version": {
    "version_type": "agent_version",
    "comparison": "gte",
    "version": "1.70.2",
    "note": "ECS-optimized AMIs released after 2024-02-02 include the patched ECS agent and runc >= 1.1.12."
  },
  "remediation_actions": [
    {
      "sequence": 1,
      "type": "version_update",
      "title": "Update ECS-optimized AMI to include runc >= 1.1.12",
      "description": "1. Update launch template to reference ECS-optimized AMI released after 2024-02-02.\n2. Drain tasks from old container instances.\n3. Terminate old instances to trigger replacement with patched AMI.\n4. Verify: docker info | grep runc shows >= 1.1.12.",
      "auto_remediable": false,
      "requires_downtime": false,
      "stateful_impact": "none",
      "compensating_control": false
    }
  ],
  "detections": [
    {
      "provider": "aws",
      "service": "guardduty",
      "query_language": "cloudwatch_filter",
      "query": "{ $.type = \"RuntimeMonitoring:ContainerEscape\" }",
      "detection_phase": "exploitation",
      "description": "GuardDuty Runtime Monitoring detects container escape attempts via file descriptor manipulation patterns characteristic of CVE-2024-21626."
    }
  ]
}
