{
  "vectorString": "CRITv0.2.0/CP:MA/VS:FX/FP:VU/SR:CA/RL:SM/EV:T/PP:1706659200/SA:1529020800#CVE-2024-21626:kubernetes_service:managedClusters",
  "vuln_id": "CVE-2024-21626",
  "provider": "azure",
  "service": "kubernetes_service",
  "resource_type": "managedClusters",
  "resource_lifecycle": "stateful_managed",
  "shared_responsibility": "customer_action_required",
  "vex_status": "fixed",
  "template": "/subscriptions/{subscriptionId}/resourceGroups/{resourceGroup}/providers/Microsoft.ContainerService/managedClusters/{name}",
  "template_format": "azure_resource_id",
  "temporal": {
    "vulnerability_introduced_date": "2019-01-01",
    "vulnerability_introduced_date_estimated": true,
    "vuln_published_date": "2024-01-31",
    "provider_acknowledged_date": "2024-02-01",
    "provider_fix_date": "2024-02-06",
    "service_available_date": "2018-06-15"
  },
  "fix_propagation": "version_update",
  "existing_deployments_remain_vulnerable": true,
  "provider_fix_version": {
    "version_type": "kubernetes_version",
    "comparison": "gte",
    "version": "1.27.9",
    "note": "AKS node images released after 2024-02-06 include containerd >= 1.7.13 with runc >= 1.1.12."
  },
  "remediation_actions": [
    {
      "sequence": 1,
      "type": "version_update",
      "title": "Upgrade AKS node image to include runc >= 1.1.12",
      "description": "az aks nodepool upgrade --resource-group {resourceGroup} --cluster-name {name} --name <nodepool> --node-image-only\n\nThis applies the latest node image with patched containerd and runc without changing the Kubernetes version.",
      "provider_guidance_url": "https://learn.microsoft.com/en-us/azure/aks/security-bulletins/overview",
      "auto_remediable": true,
      "requires_downtime": false,
      "stateful_impact": "none",
      "compensating_control": false
    }
  ],
  "detections": [
    {
      "provider": "azure",
      "service": "defender_alert",
      "query_language": "kql",
      "query": "SecurityAlert\n| where AlertType in ('AKS_ContainerEscape', 'AKS_SuspiciousContainerActivity')\n| where Description contains 'runc' or Description contains 'file descriptor'\n| project TimeGenerated, AlertName, ResourceId",
      "detection_phase": "exploitation",
      "description": "Defender for Containers alerts for container escape attempts exploiting runc file descriptor leaks."
    }
  ]
}
