{
  "vectorString": "CRITv0.2.0/CP:AW/VS:FX/FP:RL/SR:SH/RL:SM/EV:T/PP:1706659200/SA:1528243200#CVE-2024-21626:eks:cluster",
  "vuln_id": "CVE-2024-21626",
  "provider": "aws",
  "service": "eks",
  "resource_type": "cluster",
  "resource_lifecycle": "stateful_managed",
  "shared_responsibility": "shared",
  "vex_status": "fixed",
  "template": "arn:aws:eks:{region}:{account}:cluster/{resource-id}",
  "template_format": "aws_arn",
  "temporal": {
    "vuln_published_date": "2024-01-31",
    "provider_acknowledged_date": "2024-01-31",
    "provider_fix_date": "2024-02-05",
    "customer_deadline_date": "2024-03-15",
    "customer_deadline_source": "internal_policy",
    "service_available_date": "2018-06-06"
  },
  "fix_propagation": "rolling_replace",
  "existing_deployments_remain_vulnerable": true,
  "provider_fix_version": {
    "version_type": "kubernetes_version",
    "comparison": "channel_and_gte",
    "channel": "standard",
    "version": "1.28",
    "note": "EKS platform versions released after 2024-02-05 include containerd >= 1.7.13 with runc >= 1.1.12. Node groups must be updated independently."
  },
  "remediation_actions": [
    {
      "sequence": 1,
      "type": "rolling_replace",
      "title": "Trigger rolling update of EKS managed node groups",
      "description": "aws eks update-nodegroup-version --cluster-name {resource-id} --nodegroup-name <nodegroup> --launch-template version=$LATEST\n\nThis triggers a rolling replacement of nodes. Pods will be cordoned, drained, and rescheduled automatically.",
      "auto_remediable": true,
      "requires_downtime": false,
      "stateful_impact": "none",
      "compensating_control": false
    }
  ],
  "provider_advisory": {
    "advisory_url": "https://aws.amazon.com/security/security-bulletins/AWS-2024-001/"
  }
}
