{
  "vectorString": "CRITv0.2.0/CP:AW/VS:FX/FP:CC/SR:CA/RL:CF/EV:T/PP:1713139200/SA:1306886400#CVE-2024-28056:iam:role",
  "vuln_id": "CVE-2024-28056",
  "provider": "aws",
  "service": "iam",
  "resource_type": "role",
  "resource_lifecycle": "config_only",
  "shared_responsibility": "customer_action_required",
  "vex_status": "fixed",
  "template": "arn:aws:iam:{region=us-east-1}:{account}:role/{resource-id}",
  "template_format": "aws_arn",
  "temporal": {
    "vulnerability_introduced_date": "2018-07-01",
    "vulnerability_introduced_date_estimated": true,
    "vuln_published_date": "2024-04-15",
    "provider_acknowledged_date": "2024-01-16",
    "provider_fix_date": "2024-01-16",
    "customer_deadline_date": "2024-06-15",
    "customer_deadline_source": "aws_security_bulletin",
    "service_available_date": "2011-06-01"
  },
  "fix_propagation": "config_change",
  "existing_deployments_remain_vulnerable": true,
  "provider_fix_version": {
    "version_type": "runtime_version",
    "comparison": "date_gte",
    "build_date": "2024-01-16",
    "note": "AWS applied STS backend mitigations on 2024-01-16. However, IAM roles created by Amplify CLI versions prior to 12.10.1 (July 2018 -- January 2024) may still have trust policies missing the aud Condition. Customers must manually review and fix affected role trust policies."
  },
  "remediation_actions": [
    {
      "sequence": 1,
      "type": "config_change",
      "title": "Review and fix IAM role trust policies created by Amplify CLI",
      "description": "1. List IAM roles created by Amplify CLI:\n   aws iam list-roles --query \"Roles[?contains(RoleName, 'amplify')]\" --output table\n2. For each role, inspect the trust policy:\n   aws iam get-role --role-name <ROLE_NAME> --query 'Role.AssumeRolePolicyDocument'\n3. Verify that any Principal with cognito-identity.amazonaws.com includes a Condition block with 'StringEquals' on 'cognito-identity.amazonaws.com:aud' restricting to your identity pool ID.\n4. If the Condition is missing, update the trust policy to add the aud restriction:\n   aws iam update-assume-role-policy --role-name <ROLE_NAME> --policy-document file://fixed-trust-policy.json",
      "auto_remediable": false,
      "requires_downtime": false,
      "stateful_impact": "none",
      "compensating_control": false
    }
  ],
  "detections": [
    {
      "provider": "aws",
      "service": "cloudtrail",
      "query_language": "cwli",
      "query": "fields @timestamp, userIdentity.arn, sourceIPAddress, requestParameters.roleArn\n| filter eventName = 'AssumeRoleWithWebIdentity'\n| filter userIdentity.identityProvider like /cognito-identity/\n| filter sourceIPAddress not like /^10\\./\n| sort @timestamp desc",
      "detection_phase": "exploitation",
      "description": "Monitors CloudTrail for AssumeRoleWithWebIdentity calls from Cognito identity pools, particularly from unexpected source IPs. Cross-account role assumption from an attacker-controlled Cognito pool is the primary exploitation vector for CVE-2024-28056."
    },
    {
      "provider": "aws",
      "service": "config_rule",
      "query_language": "cwli",
      "query": "",
      "detection_phase": "misconfiguration",
      "pending_reason": "query_in_development",
      "description": "Placeholder: A custom AWS Config rule to detect IAM roles with Cognito-federated trust policies missing the aud Condition is being developed. The rule must parse AssumeRolePolicyDocument JSON and check for StringEquals on cognito-identity.amazonaws.com:aud."
    }
  ],
  "provider_advisory": {
    "advisory_id": "AWS-2024-003",
    "advisory_url": "https://aws.amazon.com/security/security-bulletins/AWS-2024-003/"
  }
}
