{
  "vectorString": "CRITv0.3.0/CP:GC/VS:FX/FP:VU/SR:CA/RL:SM/EV:T/PP:1706659200/SA:1440460800#CVE-2024-21626:kubernetes_engine:cluster",
  "vuln_id": "CVE-2024-21626",
  "provider": "gcp",
  "service": "kubernetes_engine",
  "resource_type": "cluster",
  "resource_lifecycle": "stateful_managed",
  "shared_responsibility": "customer_action_required",
  "vex_status": "fixed",
  "template": "//container.googleapis.com/projects/{project}/locations/{location}/clusters/{cluster}",
  "template_format": "gcp_resource_name",
  "temporal": {
    "vuln_published_date": "2024-01-31",
    "provider_acknowledged_date": "2024-02-01",
    "provider_fix_date": "2024-02-07",
    "service_available_date": "2015-08-25"
  },
  "fix_propagation": "version_update",
  "existing_deployments_remain_vulnerable": true,
  "provider_fix_version": {
    "version_type": "kubernetes_version",
    "comparison": "channel_and_gte",
    "channel": "regular",
    "version": "1.27.10-gke.1055000",
    "auto_upgrade": true,
    "note": "GKE clusters on the regular release channel will auto-upgrade. Clusters with auto-upgrade disabled must be manually upgraded."
  },
  "remediation_actions": [
    {
      "sequence": 1,
      "type": "version_update",
      "title": "Upgrade GKE cluster and node pools to patched version",
      "description": "gcloud container clusters upgrade {cluster} --location={location} --master\ngcloud container clusters upgrade {cluster} --location={location} --node-pool=<pool>\n\nFor clusters with auto-upgrade enabled, the fix will be applied during the next maintenance window.",
      "provider_guidance_url": "https://cloud.google.com/kubernetes-engine/docs/security-bulletins",
      "auto_remediable": true,
      "requires_downtime": false,
      "stateful_impact": "none",
      "compensating_control": false
    }
  ],
  "detections": [
    {
      "provider": "gcp",
      "service": "security_command_center",
      "query_language": "gcp_logging_filter",
      "query": "resource.type=\"k8s_cluster\"\nprotoPayload.methodName=\"io.k8s.core.v1.pods.exec.create\"\nprotoPayload.request.command:\"proc/self/fd\"",
      "detection_phase": "exploitation",
      "description": "Detects kubectl exec calls attempting to access /proc/self/fd paths, which is a key exploitation vector for CVE-2024-21626 runc escape."
    }
  ]
}
