{
  "vectorString": "CRITv0.2.0/CP:AW/VS:FX/FP:AU/SR:PO/RL:CF/EV:F/PP:1696896000/SA:1241568000#CVE-2023-44487:elb:loadbalancer",
  "vuln_id": "CVE-2023-44487",
  "provider": "aws",
  "service": "elb",
  "resource_type": "loadbalancer",
  "resource_lifecycle": "config_only",
  "shared_responsibility": "provider_only",
  "vex_status": "fixed",
  "template": "arn:aws:elasticloadbalancing:{region}:{account}:loadbalancer/{resource-id}",
  "template_format": "aws_arn",
  "temporal": {
    "vuln_published_date": "2023-10-10",
    "provider_fix_date": "2023-10-13",
    "service_available_date": "2009-05-06"
  },
  "fix_propagation": "automatic",
  "existing_deployments_remain_vulnerable": false,
  "provider_fix_version": {
    "version_type": "runtime",
    "comparison": "date_gte",
    "build_date": "2023-10-13"
  },
  "remediation_actions": [
    {
      "sequence": 1,
      "type": "automatic",
      "title": "Verify ALB HTTP/2 rapid reset mitigation is active",
      "description": "AWS applied HTTP/2 rapid reset mitigations to all ALB instances automatically. No customer action required. Verify by confirming no elevated HTTP 429/503 error rates in CloudWatch metrics.",
      "auto_remediable": true,
      "requires_downtime": false,
      "stateful_impact": "none",
      "compensating_control": false
    }
  ]
}
