{
  "vectorString": "CRITv0.2.0/CP:GC/VS:FX/FP:RR/SR:CO/RL:SC/EV:T/PP:1639094400/SA:1354320000#CVE-2021-44228:compute:instance",
  "vuln_id": "CVE-2021-44228",
  "provider": "gcp",
  "service": "compute",
  "resource_type": "instance",
  "resource_lifecycle": "stateful_customer",
  "shared_responsibility": "customer_only",
  "vex_status": "fixed",
  "template": "//compute.googleapis.com/projects/{project}/zones/{zone}/instances/{instance}",
  "template_format": "gcp_resource_name",
  "temporal": {
    "vuln_published_date": "2021-12-10",
    "provider_fix_date": "2021-12-20",
    "service_available_date": "2012-12-01"
  },
  "fix_propagation": "rebuild_and_redeploy",
  "existing_deployments_remain_vulnerable": true,
  "provider_fix_version": {
    "version_type": "runtime_version",
    "comparison": "gte",
    "version": "2.17.0",
    "note": "Customer-managed Java applications on GCE must update Log4j2 to >= 2.17.0. Google provides no managed runtime fix for self-hosted workloads."
  },
  "remediation_actions": [
    {
      "sequence": 1,
      "type": "rebuild_and_redeploy",
      "title": "Update Log4j2 dependency and rebuild application on GCE",
      "description": "1. Update application dependencies to use log4j-core >= 2.17.0.\n2. Rebuild application container or package.\n3. Deploy to GCE instance via instance group rolling update or manual deployment.\n4. Verify: check running classpath for log4j-core-2.17.0.jar or later.",
      "auto_remediable": false,
      "requires_downtime": false,
      "stateful_impact": "none",
      "compensating_control": false
    }
  ]
}
