{
  "vectorString": "CRITv0.2.0/CP:MA/VS:FX/FP:RR/SR:CA/RL:SC/EV:T/PP:1719792000/SA:1265241600#CVE-2024-6387:virtual_machines:virtualMachines",
  "vuln_id": "CVE-2024-6387",
  "provider": "azure",
  "service": "virtual_machines",
  "resource_type": "virtualMachines",
  "resource_lifecycle": "stateful_customer",
  "shared_responsibility": "customer_action_required",
  "vex_status": "fixed",
  "template": "/subscriptions/{subscriptionId}/resourceGroups/{resourceGroup}/providers/Microsoft.Compute/virtualMachines/{name}",
  "template_format": "azure_resource_id",
  "temporal": {
    "vulnerability_introduced_date": "2021-10-01",
    "vulnerability_introduced_date_estimated": true,
    "vuln_published_date": "2024-07-01",
    "provider_fix_date": "2024-07-10",
    "service_available_date": "2010-02-04"
  },
  "fix_propagation": "rebuild_and_redeploy",
  "existing_deployments_remain_vulnerable": true,
  "provider_fix_version": {
    "version_type": "os_image_version",
    "comparison": "date_gte",
    "build_date": "2024-07-10",
    "note": "Azure Marketplace images updated after 2024-07-10 include OpenSSH >= 9.8p1. Existing VMs require in-place package update or redeployment."
  },
  "remediation_actions": [
    {
      "sequence": 1,
      "type": "rebuild_and_redeploy",
      "title": "Redeploy VM from updated image with OpenSSH >= 9.8p1",
      "description": "1. Snapshot existing OS and data disks.\n2. Create new VM from updated Marketplace image (published after 2024-07-10).\n3. Attach data disks from snapshots.\n4. Update NSG rules and public IP associations.\n5. Deallocate and delete old VM.",
      "auto_remediable": false,
      "requires_downtime": true,
      "stateful_impact": "backup_recommended",
      "estimated_downtime_range_seconds": {
        "min": 300,
        "max": 1800
      },
      "compensating_control": false
    },
    {
      "sequence": 2,
      "type": "config_change",
      "title": "Set LoginGraceTime=0 as temporary mitigation",
      "description": "az vm run-command invoke --resource-group {resourceGroup} --name {name} --command-id RunShellScript --scripts \"sed -i 's/^#\\?LoginGraceTime.*/LoginGraceTime 0/' /etc/ssh/sshd_config && systemctl restart sshd\"",
      "auto_remediable": true,
      "requires_downtime": false,
      "stateful_impact": "none",
      "compensating_control": true
    }
  ],
  "detections": [
    {
      "provider": "azure",
      "service": "monitor_kql",
      "query_language": "kql",
      "query": "Syslog\n| where Facility == 'auth' and SeverityLevel == 'err'\n| where SyslogMessage contains 'sshd' and SyslogMessage contains 'SIGALRM'\n| project TimeGenerated, Computer, SyslogMessage",
      "detection_phase": "exploitation",
      "description": "Detects SIGALRM signals in sshd authentication logs that indicate regreSSHion exploitation attempts on Azure VMs."
    }
  ]
}
