{
  "vectorString": "CRITv0.2.0/CP:GC/VS:FX/FP:AU/SR:PO/RL:SM/EV:F/PP:1696896000/SA:1440460800#CVE-2023-44487:kubernetes_engine:cluster",
  "vuln_id": "CVE-2023-44487",
  "provider": "gcp",
  "service": "kubernetes_engine",
  "resource_type": "cluster",
  "resource_lifecycle": "stateful_managed",
  "shared_responsibility": "provider_only",
  "vex_status": "fixed",
  "template": "//container.googleapis.com/projects/{project}/locations/{location}/clusters/{cluster}",
  "template_format": "gcp_resource_name",
  "temporal": {
    "vuln_published_date": "2023-10-10",
    "service_available_date": "2015-08-25"
  },
  "fix_propagation": "automatic",
  "existing_deployments_remain_vulnerable": false,
  "provider_fix_version": {
    "version_type": "kubernetes_version",
    "comparison": "date_gte",
    "build_date": "2023-10-20"
  },
  "remediation_actions": [
    {
      "sequence": 1,
      "type": "automatic",
      "title": "GKE control plane HTTP/2 rapid reset mitigation applied automatically",
      "description": "Google applied HTTP/2 rapid reset mitigations to all GKE control planes. Google mitigated attacks reaching 398 million requests per second. No customer action required for control plane protection.",
      "auto_remediable": true,
      "requires_downtime": false,
      "stateful_impact": "none",
      "compensating_control": false
    }
  ],
  "provider_advisory": {
    "advisory_id": "GCP-2023-032",
    "advisory_url": "https://cloud.google.com/support/bulletins#GCP-2023-032"
  }
}
