{
  "vectorString": "CRITv0.2.0/CP:MA/VS:FX/FP:CC/SR:CA/RL:SC/EV:T/PP:1723507200/SA:1265241600#CVE-2024-38063:virtual_machines:virtualMachines",
  "vuln_id": "CVE-2024-38063",
  "provider": "azure",
  "service": "virtual_machines",
  "resource_type": "virtualMachines",
  "resource_lifecycle": "stateful_customer",
  "shared_responsibility": "customer_action_required",
  "vex_status": "fixed",
  "template": "/subscriptions/{subscriptionId}/resourceGroups/{resourceGroup}/providers/Microsoft.Compute/virtualMachines/{name}",
  "template_format": "azure_resource_id",
  "temporal": {
    "vuln_published_date": "2024-08-13",
    "provider_acknowledged_date": "2024-08-13",
    "provider_fix_date": "2024-08-13",
    "service_available_date": "2010-02-04"
  },
  "fix_propagation": "config_change",
  "existing_deployments_remain_vulnerable": true,
  "provider_fix_version": {
    "version_type": "os_patch",
    "comparison": "date_gte",
    "build_date": "2024-08-13",
    "note": "Microsoft released KB5041160 (and related KBs per OS version) on 2024-08-13 Patch Tuesday. Azure does not auto-apply Windows patches to customer VMs. Customers must apply the update via Windows Update, WSUS, or Azure Update Management, or disable IPv6 as a workaround."
  },
  "remediation_actions": [
    {
      "sequence": 1,
      "type": "config_change",
      "title": "Apply Windows Update KB5041160 to patch TCP/IP IPv6 vulnerability",
      "description": "1. Connect to the Azure VM via RDP or Azure Bastion.\n2. Run Windows Update and install KB5041160 (or the equivalent KB for your OS version).\n3. Restart the VM after installation.\n4. Verify the patch is installed:\n   Get-HotFix -Id KB5041160\n\nAlternatively, use Azure Update Management:\n   az vm assess-patches --resource-group {resourceGroup} --name {name}\n   az vm install-patches --resource-group {resourceGroup} --name {name} --maximum-duration PT2H --reboot-setting IfRequired --classifications-to-include-win Critical Security",
      "auto_remediable": true,
      "requires_downtime": true,
      "stateful_impact": "none",
      "estimated_downtime_range_seconds": {
        "min": 120,
        "max": 600
      },
      "compensating_control": false
    },
    {
      "sequence": 2,
      "type": "config_change",
      "title": "Disable IPv6 as temporary mitigation",
      "description": "If immediate patching is not possible, disable IPv6 via registry:\n   az vm run-command invoke --resource-group {resourceGroup} --name {name} --command-id RunPowerShellScript --scripts \"Set-ItemProperty -Path 'HKLM:\\SYSTEM\\CurrentControlSet\\Services\\Tcpip6\\Parameters' -Name 'DisabledComponents' -Value 0xFF -Type DWord; Restart-Computer -Force\"\n\nNote: Disabling IPv6 may affect Azure services that depend on IPv6 (e.g., some Azure Load Balancer configurations).",
      "auto_remediable": true,
      "requires_downtime": true,
      "stateful_impact": "none",
      "estimated_downtime_range_seconds": {
        "min": 60,
        "max": 300
      },
      "compensating_control": true
    }
  ],
  "detections": [
    {
      "provider": "azure",
      "service": "defender_alert",
      "query_language": "kql",
      "query": "SecurityAlert\n| where AlertName contains 'IPv6' or AlertName contains 'TCP/IP'\n| where ProviderName == 'Azure Security Center'\n| project TimeGenerated, AlertName, AlertSeverity, CompromisedEntity, Description",
      "detection_phase": "exploitation",
      "description": "Monitors Microsoft Defender for Cloud alerts related to anomalous IPv6 traffic patterns or TCP/IP stack exploitation on Azure VMs. The CVE-2024-38063 exploit sends specially crafted IPv6 packets that trigger an integer underflow."
    },
    {
      "provider": "azure",
      "service": "monitor_kql",
      "query_language": "kql",
      "query": "",
      "detection_phase": "misconfiguration",
      "pending_reason": "access_constraint",
      "description": "Placeholder: A Guest Configuration policy query to verify KB5041160 is installed or IPv6 is disabled (DisabledComponents=0xFF) requires validation in Azure Government (MAG) and Azure Government Secret environments. The record author lacks Azure Government subscription access needed to confirm the query works identically in those environments, where VM Guest Configuration agent behaviour may differ."
    }
  ]
}
