{
  "vectorString": "CRITv0.3.0/CP:CF/VS:FX/FP:CC/SR:CA/RL:CF/EV:T/PP:1709510400/SA:1388534400#CVE-2024-27198:waf:waf_ruleset",
  "vuln_id": "CVE-2024-27198",
  "provider": "cloudflare",
  "service": "waf",
  "resource_type": "waf_ruleset",
  "resource_lifecycle": "config_only",
  "shared_responsibility": "customer_action_required",
  "vex_status": "fixed",
  "template": "com.cloudflare.api.account.{account_id}.waf_ruleset.{id}",
  "template_format": "cloudflare_locator",
  "temporal": {
    "vuln_published_date": "2024-03-04",
    "service_available_date": "2014-01-01"
  },
  "fix_propagation": "config_change",
  "existing_deployments_remain_vulnerable": true,
  "provider_fix_version": {
    "version_type": "deployment_id",
    "comparison": "date_gte",
    "build_date": "2024-03-04"
  },
  "remediation_actions": [
    {
      "sequence": 1,
      "type": "config_change",
      "title": "Ensure WAF Managed Rules are active for JetBrains TeamCity CVE protection",
      "description": "Cloudflare WAF detected exploitation attempts just 22 minutes after proof-of-concept code was published.\n1. Verify Cloudflare Managed Ruleset is enabled on all zones proxying TeamCity instances.\n2. Confirm the CVE-2024-27198 rule action is set to Block.\n3. Review Firewall Events for any exploitation attempts that may have occurred before the rule was active.",
      "auto_remediable": true,
      "requires_downtime": false,
      "stateful_impact": "none",
      "compensating_control": false
    }
  ],
  "detections": [
    {
      "provider": "cloudflare",
      "service": "firewall_events",
      "query_language": "lucene",
      "query": "RuleID:\"managed-teamcity-cve-2024-27198\" AND Action:block",
      "detection_phase": "exploitation",
      "description": "Monitors Cloudflare Firewall Events for blocked requests matching the JetBrains TeamCity authentication bypass exploit pattern."
    },
    {
      "provider": "cloudflare",
      "service": "waf_managed_rules_api",
      "query_language": "curl",
      "query": "curl -s 'https://api.cloudflare.com/client/v4/zones/{id}/rulesets' -H 'Authorization: Bearer <token>' | jq '.result[] | select(.name == \"Cloudflare Managed Ruleset\") | .rules[] | select(.ref | contains(\"cve-2024-27198\")) | .enabled'",
      "detection_phase": "misconfiguration",
      "description": "Checks that the Cloudflare Managed WAF rule for CVE-2024-27198 remains enabled. Disabling the rule re-exposes proxied TeamCity instances to the authentication bypass."
    }
  ]
}
