{
  "vectorString": "CRITv0.3.0/CP:GC/VS:FX/FP:RR/SR:CA/RL:SC/EV:T/PP:1719792000/SA:1354320000#CVE-2024-6387:compute:instance",
  "vuln_id": "CVE-2024-6387",
  "provider": "gcp",
  "service": "compute",
  "resource_type": "instance",
  "resource_lifecycle": "stateful_customer",
  "shared_responsibility": "customer_action_required",
  "vex_status": "fixed",
  "template": "//compute.googleapis.com/projects/{project}/zones/{zone}/instances/{instance}",
  "template_format": "gcp_resource_name",
  "temporal": {
    "vulnerability_introduced_date": "2021-10-01",
    "vulnerability_introduced_date_estimated": true,
    "vuln_published_date": "2024-07-01",
    "provider_fix_date": "2024-07-09",
    "service_available_date": "2012-12-01"
  },
  "fix_propagation": "rebuild_and_redeploy",
  "existing_deployments_remain_vulnerable": true,
  "provider_fix_version": {
    "version_type": "image_family",
    "comparison": "date_gte",
    "build_date": "2024-07-09",
    "note": "Container-Optimized OS and Debian/Ubuntu images published after 2024-07-09 include patched OpenSSH."
  },
  "remediation_actions": [
    {
      "sequence": 1,
      "type": "rebuild_and_redeploy",
      "title": "Recreate GCE instance from patched image family",
      "description": "1. Create snapshot of existing disks.\n2. Delete instance (preserving disks if needed).\n3. Recreate from latest image in the same family:\n   gcloud compute instances create {instance} --zone={zone} --image-family=debian-12 --image-project=debian-cloud\n4. Reattach data disks from snapshot.\n5. Verify: ssh into instance and run 'ssh -V' to confirm >= 9.8p1.",
      "auto_remediable": false,
      "requires_downtime": true,
      "stateful_impact": "backup_recommended",
      "estimated_downtime_range_seconds": {
        "min": 120,
        "max": 900
      },
      "compensating_control": false
    }
  ],
  "detections": [
    {
      "provider": "gcp",
      "service": "cloud_logging",
      "query_language": "gcp_logging_filter",
      "query": "resource.type=\"gce_instance\"\nlogName=\"projects/{project}/logs/syslog\"\ntextPayload:\"sshd\" AND textPayload:\"SIGALRM\"",
      "detection_phase": "exploitation",
      "description": "Monitors GCE instance syslog for SIGALRM signals in sshd indicating regreSSHion race condition exploitation attempts."
    }
  ]
}
