{
  "vectorString": "CRITv0.2.0/CP:OC/VS:FX/FP:CC/SR:CA/RL:SC/EV:T/PP:1705363200/SA:1475280000#CVE-2024-20953:compute:instance",
  "vuln_id": "CVE-2024-20953",
  "provider": "oracle",
  "service": "compute",
  "resource_type": "instance",
  "resource_lifecycle": "stateful_customer",
  "shared_responsibility": "customer_action_required",
  "vex_status": "fixed",
  "template": "ocid1.instance.{realm=oc1}.{region}..{unique-id}",
  "template_format": "oracle_ocid",
  "temporal": {
    "vuln_published_date": "2024-01-16",
    "provider_acknowledged_date": "2024-01-16",
    "provider_fix_date": "2024-01-16",
    "customer_deadline_date": "2025-02-24",
    "customer_deadline_source": "cisa_kev",
    "service_available_date": "2016-10-01"
  },
  "fix_propagation": "config_change",
  "existing_deployments_remain_vulnerable": true,
  "provider_fix_version": {
    "version_type": "runtime_version",
    "comparison": "gte",
    "version": "9.3.7",
    "note": "Oracle released a patch in the January 2024 Critical Patch Update for Agile PLM version 9.3.6. Customers must apply the CPU patch or upgrade to 9.3.7+. Oracle does not auto-patch customer-deployed applications on OCI Compute."
  },
  "remediation_actions": [
    {
      "sequence": 1,
      "type": "config_change",
      "title": "Apply Oracle January 2024 CPU patch for Agile PLM",
      "description": "1. Download the January 2024 Critical Patch Update for Oracle Agile PLM from My Oracle Support.\n2. Stop the Agile PLM application server on the OCI compute instance.\n3. Apply the patch following Oracle's CPU installation guide.\n4. Restart the application server and verify the ExportServlet endpoint is patched.\n5. Alternatively, upgrade to Agile PLM 9.3.7 or later.\n6. As a compensating control until patching, restrict network access to the ExportServlet endpoint via OCI Security Lists or NSGs.",
      "auto_remediable": false,
      "requires_downtime": true,
      "stateful_impact": "backup_recommended",
      "estimated_downtime_range_seconds": {
        "min": 600,
        "max": 3600
      },
      "compensating_control": false
    }
  ],
  "detections": [
    {
      "provider": "oracle",
      "service": "oci_logging",
      "query_language": "oci_logging_query",
      "query": "search \"ocid1.compartment.oc1..{compartment}\" | where source = 'ociaudit' AND data.requestUrl contains 'ExportServlet' AND data.requestAction = 'POST'",
      "detection_phase": "exploitation",
      "description": "Monitors OCI audit logs for HTTP POST requests to the Agile PLM ExportServlet endpoint. The deserialization exploit in CVE-2024-20953 requires POST requests with crafted serialized Java objects to this servlet."
    },
    {
      "provider": "oracle",
      "service": "cloud_guard",
      "query_language": "oci_logging_query",
      "query": "",
      "detection_phase": "misconfiguration",
      "pending_reason": "no_detection_surface",
      "description": "Placeholder: OCI has no visibility into application-level software versions running inside compute instances. OCI Vulnerability Scanning detects OS-level CVEs but cannot inspect whether Oracle Agile PLM is patched or what application version is running. No OCI API, Cloud Guard detector, or metric exposes the application's patch level. The detection surface does not exist at the cloud platform layer."
    }
  ],
  "provider_advisory": {
    "advisory_id": "Oracle-CPU-Jan-2024",
    "advisory_url": "https://www.oracle.com/security-alerts/cpujan2024.html"
  }
}
