{
  "vectorString": "CRITv0.2.0/CP:MA/VS:FX/FP:CC/SR:SH/RL:SC/EV:T/PP:1719273600/SA:1596240000#CVE-2024-37085:azure_vmware_solution:privateClouds",
  "vuln_id": "CVE-2024-37085",
  "provider": "azure",
  "service": "azure_vmware_solution",
  "resource_type": "privateClouds",
  "resource_lifecycle": "stateful_customer",
  "shared_responsibility": "shared",
  "vex_status": "fixed",
  "template": "/subscriptions/{subscriptionId}/resourceGroups/{resourceGroup}/providers/Microsoft.AVS/privateClouds/{name}",
  "template_format": "azure_resource_id",
  "temporal": {
    "vuln_published_date": "2024-06-25",
    "provider_acknowledged_date": "2024-06-25",
    "provider_fix_date": "2024-06-25",
    "service_available_date": "2020-08-01"
  },
  "fix_propagation": "config_change",
  "existing_deployments_remain_vulnerable": true,
  "provider_fix_version": {
    "version_type": "runtime_version",
    "comparison": "gte",
    "version": "ESXi80U2sb-23305545",
    "note": "VMware released ESXi 8.0 Update 2c (build 23305545) and ESXi 7.0 Update 3r patches. For Azure VMware Solution, customers must also change ESXi advanced settings: set Config.HostAgent.plugins.hostsvc.esxAdminsGroupAutoAdd to false and clear Config.HostAgent.plugins.hostsvc.esxAdminsGroup."
  },
  "remediation_actions": [
    {
      "sequence": 1,
      "type": "config_change",
      "title": "Disable ESX Admins AD group auto-addition in AVS private cloud",
      "description": "1. Connect to ESXi hosts via vSphere Client in the AVS private cloud.\n2. Navigate to Host > Configure > System > Advanced System Settings.\n3. Set Config.HostAgent.plugins.hostsvc.esxAdminsGroupAutoAdd to false.\n4. Clear the Config.HostAgent.plugins.hostsvc.esxAdminsGroup value.\n5. Alternatively, apply via PowerCLI:\n   Get-VMHost | Get-AdvancedSetting -Name 'Config.HostAgent.plugins.hostsvc.esxAdminsGroupAutoAdd' | Set-AdvancedSetting -Value $false -Confirm:$false\n   Get-VMHost | Get-AdvancedSetting -Name 'Config.HostAgent.plugins.hostsvc.esxAdminsGroup' | Set-AdvancedSetting -Value '' -Confirm:$false\n6. Monitor Active Directory for creation of groups named 'ESX Admins' (case-insensitive).",
      "auto_remediable": false,
      "requires_downtime": false,
      "stateful_impact": "none",
      "compensating_control": false
    }
  ],
  "detections": [
    {
      "provider": "azure",
      "service": "sentinel_analytics",
      "query_language": "kql",
      "query": "AuditLogs\n| where OperationName == 'Add group'\n| extend GroupName = tostring(TargetResources[0].displayName)\n| where GroupName =~ 'ESX Admins'\n| project TimeGenerated, InitiatedBy, GroupName, Result",
      "detection_phase": "exploitation",
      "description": "Monitors Azure AD audit logs for creation of groups named 'ESX Admins' (case-insensitive). An attacker with AD permissions creates this group to gain full ESXi administrator access via the default auto-addition behaviour."
    },
    {
      "provider": "azure",
      "service": "monitor_kql",
      "query_language": "kql",
      "query": "",
      "detection_phase": "misconfiguration",
      "pending_reason": "awaiting_provider_telemetry",
      "description": "Placeholder: Azure VMware Solution does not expose ESXi advanced configuration settings (esxAdminsGroupAutoAdd, esxAdminsGroup) via Azure Resource Manager APIs, Azure Monitor, or Azure Resource Graph. These settings are only accessible via vSphere Client or ESXi shell, neither of which feeds into Azure's monitoring plane. A misconfiguration detection query cannot be authored until Azure surfaces ESXi host configuration as ARM telemetry."
    }
  ]
}
