{
  "vectorString": "CRITv0.2.0/CP:AW/VS:FX/FP:RL/SR:CA/RL:SM/EV:T/PP:1719792000/SA:1528243200#CVE-2024-6387:eks:nodegroup",
  "vuln_id": "CVE-2024-6387",
  "provider": "aws",
  "service": "eks",
  "resource_type": "nodegroup",
  "resource_lifecycle": "stateful_managed",
  "shared_responsibility": "customer_action_required",
  "vex_status": "fixed",
  "template": "arn:aws:eks:{region}:{account}:nodegroup/{resource-id}",
  "template_format": "aws_arn",
  "temporal": {
    "vuln_published_date": "2024-07-01",
    "provider_acknowledged_date": "2024-07-02",
    "provider_fix_date": "2024-07-10",
    "service_available_date": "2018-06-06"
  },
  "fix_propagation": "rolling_replace",
  "existing_deployments_remain_vulnerable": true,
  "provider_fix_version": {
    "version_type": "ami",
    "comparison": "date_gte",
    "build_date": "2024-07-10",
    "auto_upgrade": false
  },
  "remediation_actions": [
    {
      "sequence": 1,
      "type": "rolling_replace",
      "title": "Update EKS managed node group AMI to version with OpenSSH >= 9.8p1",
      "description": "aws eks update-nodegroup-version --cluster-name <cluster> --nodegroup-name {resource-id} --launch-template version=$LATEST\n\nThis triggers a rolling replacement. Ensure PodDisruptionBudgets are configured to maintain availability during rollout.",
      "auto_remediable": true,
      "requires_downtime": false,
      "stateful_impact": "none",
      "compensating_control": false
    }
  ],
  "detections": [
    {
      "provider": "aws",
      "service": "security_hub",
      "query_language": "cloudwatch_filter",
      "query": "{ $.ProductFields.StandardsArn = 'arn:aws:securityhub:::standards/aws-foundational-security-best-practices/v/1.0.0' && $.Title like 'CVE-2024-6387' }",
      "detection_phase": "pre_fix",
      "description": "Security Hub findings for CVE-2024-6387 on EKS node group instances. Inspector surfaces this finding when scanning node AMIs."
    }
  ]
}
