{
  "vectorString": "CRITv0.3.0/CP:AW/VS:FX/FP:RD/SR:SH/RL:EP/EV:T/PP:1639094400/SA:1416355200#CVE-2021-44228:lambda:function",
  "vuln_id": "CVE-2021-44228",
  "provider": "aws",
  "service": "lambda",
  "resource_type": "function",
  "resource_lifecycle": "ephemeral",
  "shared_responsibility": "shared",
  "vex_status": "fixed",
  "template": "arn:aws:lambda:{region}:{account}:function/{resource-id}",
  "template_format": "aws_arn",
  "temporal": {
    "vuln_published_date": "2021-12-10",
    "provider_fix_date": "2021-12-16",
    "service_available_date": "2014-11-19"
  },
  "fix_propagation": "redeploy",
  "existing_deployments_remain_vulnerable": true,
  "provider_fix_version": {
    "version_type": "runtime",
    "comparison": "date_gte",
    "build_date": "2021-12-16",
    "note": "AWS deployed a hot-patch Lambda layer that disables JNDI lookup. Customers must also update Log4j2 to >= 2.17.0 in function code."
  },
  "remediation_actions": [
    {
      "sequence": 1,
      "type": "redeploy",
      "title": "Update Log4j2 dependency to 2.17.0+ and redeploy Lambda function",
      "description": "1. Update pom.xml or build.gradle to use log4j-core >= 2.17.0.\n2. Rebuild deployment package.\n3. aws lambda update-function-code --function-name {resource-id} --zip-file fileb://function.zip",
      "auto_remediable": false,
      "requires_downtime": false,
      "stateful_impact": "none",
      "compensating_control": false
    }
  ],
  "provider_advisory": {
    "advisory_id": "AWS-2021-006",
    "advisory_url": "https://aws.amazon.com/security/security-bulletins/AWS-2021-006/"
  }
}
