{
  "vectorString": "CRITv0.2.0/CP:CF/VS:FX/FP:CC/SR:CA/RL:CF/EV:T/PP:1717632000/SA:1388534400#CVE-2024-4577:waf:waf_ruleset",
  "vuln_id": "CVE-2024-4577",
  "provider": "cloudflare",
  "service": "waf",
  "resource_type": "waf_ruleset",
  "resource_lifecycle": "config_only",
  "shared_responsibility": "customer_action_required",
  "vex_status": "fixed",
  "template": "com.cloudflare.api.account.{account_id}.waf_ruleset.{id}",
  "template_format": "cloudflare_locator",
  "temporal": {
    "vuln_published_date": "2024-06-06",
    "provider_acknowledged_date": "2024-06-07",
    "provider_fix_date": "2024-06-07",
    "service_available_date": "2014-01-01"
  },
  "fix_propagation": "config_change",
  "existing_deployments_remain_vulnerable": true,
  "provider_fix_version": {
    "version_type": "deployment_id",
    "comparison": "date_gte",
    "build_date": "2024-06-07",
    "note": "Cloudflare deployed WAF managed rules for CVE-2024-4577 on 2024-06-07. Customers must ensure: (1) Managed Ruleset is enabled on their zone, (2) the PHP-CGI rule is set to Block not Log, and (3) the zone is proxied through Cloudflare."
  },
  "remediation_actions": [
    {
      "sequence": 1,
      "type": "config_change",
      "title": "Enable Cloudflare WAF Managed Rules for PHP-CGI CVE protection",
      "description": "1. Navigate to Security > WAF > Managed Rules in Cloudflare dashboard.\n2. Ensure the Cloudflare Managed Ruleset is enabled for the zone.\n3. Verify the PHP-CGI argument injection rule (CVE-2024-4577) is set to 'Block' action, not 'Log'.\n4. Confirm the zone's DNS records are proxied (orange cloud) through Cloudflare.\n\nAlternatively via API:\ncurl -X GET 'https://api.cloudflare.com/client/v4/zones/{id}/rulesets' -H 'Authorization: Bearer <token>' | jq '.result[] | select(.name == \"Cloudflare Managed Ruleset\") | .rules[] | select(.description | contains(\"PHP\"))'",
      "auto_remediable": true,
      "requires_downtime": false,
      "stateful_impact": "none",
      "compensating_control": false
    }
  ],
  "detections": [
    {
      "provider": "cloudflare",
      "service": "firewall_events",
      "query_language": "lucene",
      "query": "RuleID:\"managed-php-cgi-cve-2024-4577\" AND Action:block",
      "detection_phase": "exploitation",
      "description": "Monitors Cloudflare Firewall Events for blocked requests matching the PHP-CGI argument injection exploit pattern. The attack uses soft hyphen (0xAD) encoding to bypass CGI argument parsing on Windows PHP installations."
    },
    {
      "provider": "cloudflare",
      "service": "firewall_events",
      "query_language": "lucene",
      "query": "",
      "detection_phase": "misconfiguration",
      "pending_reason": "pending_review",
      "description": "Placeholder: A misconfiguration detection query to verify the PHP-CGI WAF rule remains enabled has been drafted but is under review. The review must confirm: (1) the correct managed rule ID/reference for CVE-2024-4577 across all Cloudflare WAF engine versions, (2) coverage of all encoding variants (0xAD, %AD, Unicode normalization), and (3) whether legacy WAF vs. new WAF Managed Rules engine differences affect detection accuracy."
    }
  ]
}
