{
  "vectorString": "CRITv0.3.0/CP:MA/VS:FX/FP:RD/SR:CA/RL:EP/EV:T/PP:1639094400/SA:1371168000#CVE-2021-44228:app_service:sites",
  "vuln_id": "CVE-2021-44228",
  "provider": "azure",
  "service": "app_service",
  "resource_type": "sites",
  "resource_lifecycle": "ephemeral",
  "shared_responsibility": "customer_action_required",
  "vex_status": "fixed",
  "template": "/subscriptions/{subscriptionId}/resourceGroups/{resourceGroup}/providers/Microsoft.Web/sites/{name}",
  "template_format": "azure_resource_id",
  "temporal": {
    "vuln_published_date": "2021-12-10",
    "provider_fix_date": "2021-12-18",
    "service_available_date": "2013-06-14"
  },
  "fix_propagation": "redeploy",
  "existing_deployments_remain_vulnerable": true,
  "provider_fix_version": {
    "version_type": "runtime_version",
    "comparison": "gte",
    "version": "2.17.0",
    "note": "Applies to Java-based App Service deployments using Log4j2. Update Log4j2 dependency and redeploy."
  },
  "remediation_actions": [
    {
      "sequence": 1,
      "type": "redeploy",
      "title": "Update Log4j2 to >= 2.17.0 and redeploy App Service",
      "description": "1. Update pom.xml or build.gradle: set log4j-core version to 2.17.0 or later.\n2. Rebuild application artifact.\n3. az webapp deploy --resource-group {resourceGroup} --name {name} --src-path app.jar --type jar",
      "provider_guidance_url": "https://msrc.microsoft.com/blog/2021/12/microsofts-response-to-cve-2021-44228-apache-log4j2/",
      "auto_remediable": false,
      "requires_downtime": false,
      "stateful_impact": "none",
      "compensating_control": false
    }
  ],
  "provider_advisory": {
    "advisory_url": "https://msrc.microsoft.com/blog/2021/12/microsofts-response-to-cve-2021-44228-apache-log4j2/"
  }
}
