{
  "vectorString": "CRITv0.2.0/CP:AW/VS:FX/FP:VU/SR:SH/RL:SM/EV:T/PP:1639094400/SA:1238630400#CVE-2021-44228:emr:cluster",
  "vuln_id": "CVE-2021-44228",
  "provider": "aws",
  "service": "emr",
  "resource_type": "cluster",
  "resource_lifecycle": "stateful_managed",
  "shared_responsibility": "shared",
  "vex_status": "fixed",
  "template": "arn:aws:elasticmapreduce:{region}:{account}:cluster/{resource-id}",
  "template_format": "aws_arn",
  "temporal": {
    "service_available_date": "2009-04-02",
    "vulnerability_introduced_date": "2013-09-17",
    "vulnerability_introduced_date_estimated": true,
    "vuln_published_date": "2021-12-10",
    "provider_acknowledged_date": "2021-12-11",
    "provider_fix_date": "2021-12-15",
    "customer_deadline_date": "2022-01-10",
    "customer_deadline_source": "cisa_kev"
  },
  "fix_propagation": "version_update",
  "existing_deployments_remain_vulnerable": true,
  "provider_fix_version": {
    "version_type": "runtime",
    "comparison": "gte",
    "version": "emr-5.34.1",
    "note": "EMR 5.34.1 and EMR 6.6.0+ include the Log4j2 hot-patch. Existing clusters require a bootstrap action or step to apply the hot-patch."
  },
  "remediation_actions": [
    {
      "sequence": 1,
      "type": "version_update",
      "title": "Upgrade EMR cluster to release with Log4j2 fix",
      "description": "For new clusters: use EMR release label emr-5.34.1 or later (emr-6.6.0+ for EMR 6.x).\nFor running clusters: apply the AWS-provided hot-patch bootstrap action.\n  aws emr add-steps --cluster-id {resource-id} --steps Type=CUSTOM_JAR,Name=Log4jHotPatch,Jar=s3://aws-emr-bda-solution/log4j-hotpatch.jar",
      "provider_guidance_url": "https://aws.amazon.com/security/security-bulletins/AWS-2021-006/",
      "auto_remediable": false,
      "requires_downtime": false,
      "stateful_impact": "none",
      "compensating_control": false
    }
  ],
  "detections": [
    {
      "provider": "aws",
      "service": "cloudtrail",
      "query_language": "cwli",
      "query": "fields @timestamp, userIdentity.arn, sourceIPAddress, eventName | filter eventSource = 'elasticmapreduce.amazonaws.com' AND eventName = 'RunJobFlow' | sort @timestamp desc",
      "detection_phase": "post_fix",
      "description": "Monitors for new EMR cluster launches to verify they use a patched release label. Cross-reference release label against known-fixed versions."
    }
  ],
  "provider_advisory": {
    "advisory_id": "AWS-2021-006",
    "advisory_url": "https://aws.amazon.com/security/security-bulletins/AWS-2021-006/"
  }
}
