{
  "vectorString": "CRITv0.3.0/CP:OC/VS:FX/FP:VU/SR:CA/RL:SM/EV:T/PP:1706659200/SA:1527811200#CVE-2024-21626:oke:cluster",
  "vuln_id": "CVE-2024-21626",
  "provider": "oracle",
  "service": "oke",
  "resource_type": "cluster",
  "resource_lifecycle": "stateful_managed",
  "shared_responsibility": "customer_action_required",
  "vex_status": "fixed",
  "template": "ocid1.cluster.{realm=oc1}.{region}..{unique-id}",
  "template_format": "oracle_ocid",
  "temporal": {
    "vuln_published_date": "2024-01-31",
    "provider_fix_date": "2024-02-10",
    "service_available_date": "2018-06-01"
  },
  "fix_propagation": "version_update",
  "existing_deployments_remain_vulnerable": true,
  "provider_fix_version": {
    "version_type": "kubernetes_version",
    "comparison": "gte",
    "version": "1.27.10",
    "auto_upgrade": false
  },
  "remediation_actions": [
    {
      "sequence": 1,
      "type": "version_update",
      "title": "Upgrade OKE cluster and node pools to include runc >= 1.1.12",
      "description": "1. Upgrade OKE cluster control plane:\n   oci ce cluster update --cluster-id {unique-id} --kubernetes-version v1.27.10\n2. Upgrade node pools:\n   oci ce node-pool update --node-pool-id <pool-ocid> --kubernetes-version v1.27.10\n3. Cycle nodes in the node pool to pick up the new image with patched runc.",
      "auto_remediable": false,
      "requires_downtime": false,
      "stateful_impact": "none",
      "compensating_control": false
    }
  ]
}
